descricao,Categoria
caneta bic cristal,Papelaria
caneta bic cristal,Papelaria
caneta bic cristal,Papelaria
caneta bic cristal,Papelaria
caneta bic cristal,Papelaria
caneta bic cristal,Papelaria
caneta bps pilot,Papelaria
caneta marcador permanente acrilex ponta dupla,Papelaria
caneta retocar madeira branco corcel,Papelaria
caneta retroprojetor manter fazer castelo ponta dia,Papelaria
caneta personalizada base,Papelaria
caneta personalizada,Papelaria
caneta personalizada,Papelaria
caneta personalizada ver,Papelaria
caneta bic cristal,Papelaria
nao repor caneta fine black cod estojo,Papelaria
nao repor caneta passo classe collectiom cromo,Papelaria
bic caneta cristal,Papelaria
bic caneta cristal fina,Papelaria
caneta bic,Papelaria
caneta bic cristal,Papelaria
caneta bic cristal,Papelaria
caneta bic cristal,Papelaria
caneta cristal,Papelaria
caneta polaridade,Papelaria
caneta ecologica papelao clip colorido,Papelaria
caneta esferografica bic cristal,Papelaria
caneta esferografica bic cristal,Papelaria
caneta esferografica bic cristal cor sortudas,Papelaria
caneta fixa solufix pratica base cremada,Papelaria
caneta marca texto,Papelaria
caneta marca texto amarela,Papelaria
caneta marca texto brw fluorescente,Papelaria
caneta marca texto,Papelaria
caneta marca texto,Papelaria
caneta vidro,Papelaria
caneta plastica personalizada,Papelaria
caneta plastica touch suporte,Papelaria
caneta plastica touch suporte,Papelaria
igo caneta touch,Papelaria
kit caneta abridor lanterna,Papelaria
kit caneta abridor lanterna,Papelaria
mkt brindes caneta,Papelaria
mkt caneta base touch,Papelaria
mkt caneta base mim mosca,Papelaria
mkt caneta mano filme,Papelaria
mkt caneta mano filme,Papelaria
mkt caneta plastica hell,Papelaria
mkt caneta plastica touch suporte,Papelaria
mkt caneta rifle,Papelaria
caneta bic cristal,Papelaria
caneta bic cristal,Papelaria
caneta bic cristal,Papelaria
caneta bic cristal,Papelaria
caneta bic cristal,Papelaria
caneta bic cristal,Papelaria
caneta bic cristal,Papelaria
caneta bic cristal,Papelaria
caneta bic cristal,Papelaria
caneta fixador balcao,Papelaria
caneta fixador balcao,Papelaria
caneta fixador balcao,Papelaria
caneta marca texto amar,Papelaria
caneta marca texto amarela,Papelaria
caneta marca texto amarela,Papelaria
caneta marca texto amarela,Papelaria
caneta marca texto,Papelaria
caneta marca texto,Papelaria
caneta marca texto,Papelaria
caneta ret pro desta,Papelaria
caneta ret pro desta,Papelaria
caneta ret pro ver desta,Papelaria
caneta ret pro ver desta,Papelaria
caneta retro protetor,Papelaria
caneta retro protetor pilot,Papelaria
caneta retro protetor pilot,Papelaria
caneta retro protetor pilot,Papelaria
caneta retro protetor pilot,Papelaria
caneta retro protetor,Papelaria
caneta retro protetor,Papelaria
caneta retro protetor,Papelaria
caneta retro protetor ver pontas,Papelaria
caneta wbm pilot,Papelaria
rec caneta medium castelo pto,Papelaria
rec caneta medium castelo pto,Papelaria
rec caneta medium castelo vmo,Papelaria
rec caneta medium castelo vmo,Papelaria
caneta basica,Papelaria
caneta bic sim clip,Papelaria
caneta chow elegante,Papelaria
caneta chow embaixador,Papelaria
caneta chow fique,Papelaria
caneta eco,Papelaria
caneta bic,Papelaria
caneta compacto,Papelaria
caneta esf pilot bps ponta metal,Papelaria
caneta especial,Papelaria
caneta gripe gel,Papelaria
caneta marca texto light,Papelaria
caneta marca texto desta rosa,Papelaria
caneta marca texto light,Papelaria
caneta marca texto light rosa,Papelaria
caneta permanente vidro,Papelaria
caneta retroprojetor,Papelaria
caneta retroprojetor,Papelaria
kit canetas teste superficial dona coroa,Papelaria
caneta bps gripe cor piloto caneta pilot bps gripe cor,Papelaria
caneta esferografica cor caneta esferografica cor marca bic,Papelaria
caneta esferografica cor caneta esferografica cor marca bic,Papelaria
caneta esferografica cor caneta esferografica cor marca bic,Papelaria
caneta esferografica escrita fina caneta escrita fina,Papelaria
caneta indelevel marcador caneta indelevel marcador fazer castelo,Papelaria
caneta lumicolor marca texto caneta lumicolor marca texto,Papelaria
caneta lumicolor marca texto caneta lumicolor marca texto,Papelaria
caneta lumicolor marca texto caneta lumicolor marca texto,Papelaria
caneta lumicolor marca texto rosa caneta lumicolor marca texto rosa,Papelaria
caneta lumicolor marca texto caneta lumicolor marca texto,Papelaria
caneta pneu last caneta pneu branca ponta grossa corpo plastico unidade,Papelaria
caneta quadro branco cor caneta quadro branco cor,Papelaria
caneta quadro branco cor caneta quadro branco cor,Papelaria
caneta quadro branco cor caneta quadro branco cor,Papelaria
caneta quadro branco cor caneta quadro branco cor,Papelaria
caneta retroprojetor marcador transparencia caneta retroprojetor marcador transparencia,Papelaria
caneta teste polaridade superaste scan caneta teste polaridade superaste scan,Papelaria
caneta,Papelaria
caneta esfera cristal fina bic,Papelaria
caneta esfera cristal fina bic,Papelaria
caneta esfera cristal fina bic,Papelaria
caneta esfera medium fazer caneta esferografica medium fazer castelo,Papelaria
caneta esfera medium fazer caneta esferografica medium fazer castelo,Papelaria
caneta esferografica bps gripe,Papelaria
caneta esferografica bps gripe,Papelaria
caneta esferografica cristal bic,Papelaria
caneta esferografica cristal bic,Papelaria
caneta esferografica cristal ponta fina,Papelaria
caneta esferografica cristal bic,Papelaria
caneta esferografica cristal bic,Papelaria
caneta esferografica cristal bic ref aluna,Papelaria
caneta esferografica cristal,Papelaria
caneta esferografica ponta dia grampear mesa metal papel,Papelaria
caneta esferografica ponta dia prender papel tipo grampomol gene,Papelaria
caneta esfera retrato sim metal caneta esferografica retrato sim metal bic,Papelaria
caneta esf retrair laknock grampear cama premium sortudos,Papelaria
caneta hidro point sabido verme caneta hidrogrfica point sabido codigo aluna,Papelaria
caneta hidrogrfica cor calor,Papelaria
caneta hidrogrfica calor junior azu pilot,Papelaria
caneta hidrogrfica calor junior pre pilot,Papelaria
caneta hidrogrfica fine pen fpa,Papelaria
caneta hidrogrfica fine pen,Papelaria
caneta hidrografica ponta medium prt,Papelaria
caneta ind ken grite,Papelaria
caneta ind branco ken grite,Papelaria
caneta dvd blu ray pilot,Papelaria
caneta retro projetor,Papelaria
caneta retro projetor,Papelaria
caneta retro projetor pilot,Papelaria
caneta retro projetor caixa,Papelaria
caneta retro projetor,Papelaria
caneta retro projetor,Papelaria
caneta uniposca,Papelaria
obc caneta,Papelaria
obc caneta,Papelaria
caneta esferografica cristal bic marca modelo cor tamanho,Papelaria
caneta bic,Papelaria
caneta marca texto lume calor pilot,Papelaria
caneta ponta fina bic,Papelaria
caneta bic ponta grossa,Papelaria
caneta bic cor,Papelaria
caneta bic cor,Papelaria
caneta compacto cor,Papelaria
caneta compacto cor,Papelaria
caneta compacto cor,Papelaria
caneta metal corrente,Papelaria
caneta metal fixa base fixa,Papelaria
caneta metal corrente,Papelaria
caneta detectavel nao retrato clipe bolso ref pro cod,Papelaria
caneta detectavel nao retrato ref pro cod,Papelaria
caneta detectavel retrato clipe bolso codificada ref pro cod,Papelaria
caneta esferografica cor,Papelaria
caneta esferografica agiste aluminio compacto,Papelaria
caneta esferografica young cor prata,Papelaria
caneta hidrografica cor,Papelaria
caneta hidrografica cor tecpoint pilot,Papelaria
caneta hidrografica point sabido,Papelaria
caneta marcador grite mark clister ponta poros medium,Papelaria
caneta marca texto amarela pilot,Papelaria
caneta marca texto,Papelaria
caneta marca texto pilot,Papelaria
caneta marca texto pilot,Papelaria
caneta pilot hidrografica tecpoint,Papelaria
caneta ponta poros fazer castelo,Papelaria
caneta possa uni ball,Papelaria
carga caneta detectavel retrato cod,Papelaria
refiz caneta compacto esferografica aluminio,Papelaria
caneta esferografica cor ref fazer castelo bic compacto,Papelaria
caneta esferografica cor ref fazer castelo bic compacto,Papelaria
caneta esferografica cor ref fazer castelo bic compacto,Papelaria
caneta marcador permanente dvd ref pilot,Papelaria
caneta marcador retro projetor cor ref pilot,Papelaria
caneta marca texto,Papelaria
caneta esferografica marca bic produto servico mexe caneta esferografica marca bic utilizar padre geral status cadastro estoque,Papelaria
caneta esferografica produto servico centro custo solicitando aprovado utilizar padre grp administrar geral grs descrito complementar,Papelaria
caneta esferografica produto servico cod conta centro custo solicitando aprovado utilizar padre grp administrar geral grs descrito complementar,Papelaria
caneta esferografica produto servico utilizar padre geral status cadastro estoque,Papelaria
caneta esferografica produto servico caneta esferografica centro custo solicitando aprovado utilizar padre grp grs descrito complementar,Papelaria
caneta esferografica produto servico utilizar padre geral status cadastro estoque,Papelaria
caneta esferografica produto servico caneta esferografica centro custo solicitando aprovado utilizar padre grp administrar geral grs descrito complementar,Papelaria
caneta fixa corrente produto servico centro custo solicitando aprovado utilizar padre grp grs descrito complementar,Papelaria
caneta marca texto amarela produto servico caneta marca texto amarela utilizar padre geral status cadastro estoque,Papelaria
caneta marca texto produto servico caneta marca texto utilizar padre escritorio status cadastro aplicar direta,Papelaria
caneta marca texto cinza produto servico utilizar padre geral status cadastro aplicar direta,Papelaria
caneta marca texto produto servico utilizar padre geral status cadastro aplicar direta,Papelaria
caneta marca texto rosa produto servico utilizar padre escritorio status cadastro aplicar direta,Papelaria
caneta marca texto produto servico utilizar padre geral status cadastro estoque,Papelaria
caneta mkt produto servico utilizar padre brindes mkt descrito complementar,Papelaria
caneta brinde produto servico utilizar padre geral descrito complementar aplicar direta,Papelaria
caneta ponta fina bic produto servico caneta bic ponta fina centro custo solicitando aprovado descrito complementar,Papelaria
caneta retro protetora produto servico caneta retro projeto ponta centro custo solicitando aprovado utilizar padre grp escritorio grs descrito complementar,Papelaria
caneta retro protetora produto servico caneta retro projeto ponta cod conta centro custo solicitando aprovado utilizar padre grp escritorio grs descrito complementar,Papelaria
caneta retro protetora produto servico caneta retro projetor centro custo solicitando aprovado utilizar padre grp grs descrito complementar,Papelaria
caneta retro protetora produto servico caneta retro projetor centro custo solicitando aprovado utilizar padre grp escritorio grs descrito complementar,Papelaria
caneta retro protetora produto servico caneta retro projetor centro custo solicitando aprovado utilizar padre grp grs descrito complementar,Papelaria
caneta retro protetora produto servico caneta retro projetor centro custo solicitando aprovado utilizar padre grp grs descrito complementar,Papelaria
caneta retroprojetor pilot produto servico caneta retroprojetor marca pilot utilizar padre geral status cadastro estoque,Papelaria
canetas brindes mkt und produto servico utilizar padre brindes mkt descrito complementar,Papelaria
caneta touch tablet produto servico utilizar padre geral status cadastro aplicar direta,Papelaria
kit caneta hidrocor produto servico utilizar padre geral status cadastro aplicar direta,Papelaria
caneta bic cristal,Papelaria
caneta bic cristal,Papelaria
caneta bic cristal,Papelaria
caneta esferografica modelo hbl,Papelaria
caneta esferografica logotipo base,Papelaria
caneta esf yes pro gel,Papelaria
caneta base sap,Papelaria
caneta metalica laser lanterna,Papelaria
caneta pilot lume calor amarela,Papelaria
caneta pilot lume calor,Papelaria
caneta pilot lume calor,Papelaria
caneta pilot lume calor rosa,Papelaria
caneta pilot lume calor,Papelaria
caneta ponta poros sofpoint,Papelaria
caneta ponta poros sofpoint,Papelaria
caneta ponta poros sofpoint,Papelaria
caneta ultra fine papermate,Papelaria
carga caneta caa cromo,Papelaria
caneta big super gripe pilot,Papelaria
caneta branca ponta fina,Papelaria
caneta cia base,Papelaria
caneta detector celulas,Papelaria
caneta esf fine bic,Papelaria
caneta esf cristal bic caneta esferografica cristal fina bic,Papelaria
caneta esf cristal bic caneta esferografica cristal bic,Papelaria
caneta esf gripe,Papelaria
caneta esf bps ponta fina pilot caneta esferografica bps ponta fina pilot ponta metal,Papelaria
caneta esferograf espero caneta esferografica aspiro,Papelaria
caneta esferografica,Papelaria
caneta esferografica,Papelaria
caneta esferografica,Papelaria
caneta esferografica prata ponta fina caneta ponta fina cor prata utilizado mataria fazer marca pontos malha principalmente malha escura,Papelaria
caneta hidrocor define pen,Papelaria
caneta hidrocor define pen,Papelaria
caneta hidrocor ver define pen,Papelaria
caneta hidro sabido point caneta hidrografica sabido point clister,Papelaria
caneta hidro sabido point mar,Papelaria
caneta hidro sabido point,Papelaria
caneta hidro sabido point rosa,Papelaria
caneta hidro sabido point,Papelaria
caneta metal personalizada caneta metal personalizada material expediente nacional,Papelaria
caneta manequim uniria ponta,Papelaria
caneta manequim uniria ponta,Papelaria
caneta tecido,Papelaria
caneta promocional base,Papelaria
caneta promocional base kid,Papelaria
caneta tecido acrilex,Papelaria
caneta tecido acrilpen petroleo,Papelaria
caneta ret pontas,Papelaria
caneta ret pontas,Papelaria
caneta ret pontas,Papelaria
caneta ret pontas verme lho,Papelaria
caneta retroprojetor fazer marca fazer castelo,Papelaria
caneta retroprojetor ver fazer marca fazer castelo,Papelaria
caneta retroprojetor fazer marca fazer castelo,Papelaria
caneta retroprojetor maxprint caneta retroprojetor maxprint,Papelaria
caneta retroprojetor fazer marca fazer castelo,Papelaria
caneta retroprojetor ver fazer marca fazer castelo,Papelaria
correio caneta ponta metal bic,Papelaria
exp caneta caneta nacional,Papelaria
exp caneta destaca texto,Papelaria
exp caneta destaca texto,Papelaria
exp caneta destaca texto,Papelaria
exp caneta destaca texto rosa,Papelaria
exp caneta destaca texto,Papelaria
exp caneta destaca texto violeta,Papelaria
exp caneta esferografica,Papelaria
exp caneta esferografica,Papelaria
exp caneta esferografica ver,Papelaria
exp caneta esferografica,Papelaria
exp caneta esferografica,Papelaria
exp caneta esferografica,Papelaria
exp caneta esferografica,Papelaria
exp caneta esferografica,Papelaria
exp caneta esferografica ver,Papelaria
exp caneta fantasma apagarem,Papelaria
exp caneta fantasma apagarem,Papelaria
exp caneta fantasma apagarem,Papelaria
exp caneta hidrogrfica cor,Papelaria
exp caneta hidrogrfica cor marca tres,Papelaria
exp caneta retro pilot,Papelaria
exp caneta retro pilot,Papelaria
exp caneta retro ver pilot,Papelaria
exp caneta tecido amarela,Papelaria
exp caneta tecido,Papelaria
exp caneta tecido branca,Papelaria
exp caneta tecido marrom,Papelaria
exp caneta tecido,Papelaria
exp caneta tecido rosa,Papelaria
exp caneta tecido,Papelaria
exp caneta tecido,Papelaria
exp caneta tecido vinho,Papelaria
exp correio caneta ponta metal shake squeeze bic,Papelaria
exp porta caneta armado redondo nacional,Papelaria
exp porta caneta clip lembrete fume,Papelaria
exp recarga caneta tinteiro cromo,Papelaria
caneta esferografica,Papelaria
caneta esferografica,Papelaria
caneta hidrografia,Papelaria
caneta marca texto,Papelaria
caneta pincel,Papelaria
caneta retro projetor,Papelaria
caneta retro projetor,Papelaria
porta canetas,Papelaria
bombeiros caneta esferografica cor cor unica,Papelaria
caneta,Papelaria
caneta amora medo,Papelaria
caneta amora medo caneta modelo caneta espero material plastico acabamento front escrita cor gravacao cor,Papelaria
caneta amora medo cor cor unica caneta modelo caneta espero material plastico acabamento front escrita cor gravacao cor,Papelaria
caneta quadro branco ponta fina cor cor unica,Papelaria
caneta bic gripe roller fine,Papelaria
caneta bic gripe roller fine cor cor unica,Papelaria
caneta bic roller black,Papelaria
caneta bic roller black cor cor unica,Papelaria
caneta bisnaga marca malha,Papelaria
caneta bisnaga macaco malha,Papelaria
caneta bisnaga macaco malha cor cor unica,Papelaria
caneta conta comigo caneta logo estampa conta comigo grupo base cor,Papelaria
caneta conta comigo cor cor unica caneca logo estampa conta comigo grupo base cor,Papelaria
caneta correria cor cor unica caneta tipo correria cor branca apresentacao,Papelaria
caneta correria,Papelaria
caneta correria,Papelaria
caneta correria cor cor unica caneta tipo correria cor branca apresentacao referencia fabricante fazer castelo,Papelaria
caneta detector dinheiro falso,Papelaria
caneta detector dinheiro falso cor cor unica,Papelaria
caneta espero aluminio touch xmm caneta modelo esferografica ponteiro touch dimensoes xmm material aluminio complemento,Papelaria
caneta espero ilumina touch xmm,Papelaria
caneta espero ilumina touch xmm cor cor unica caneta modelo esferografica ponteiro touch dimensoes xmm material aluminio complemento,Papelaria
caneta esferografica,Papelaria
caneta esferografica,Papelaria
caneta esferografica,Papelaria
caneta esferografica,Papelaria
caneta esferografica cor cor unica,Papelaria
caneta esferografica cor cor unica,Papelaria
caneta esferografica,Papelaria
caneta esferografica,Papelaria
caneta esferografica cor cor unica,Papelaria
caneta esferografica cor cor unica,Papelaria
caneta esferografica med cor caneta tipo caneta esferografica ponta medium cor tinta forma fornecimento aviso apresentacao,Papelaria
caneta esferografica,Papelaria
caneta esferografica,Papelaria
caneta esferografica cor cor unica,Papelaria
caneta esferografica cor cor unica,Papelaria
caneta esf presidente eternity dourada ywo cromo caneta esferografica modelo caneta esferografica presidente ywo cromo aplicacao diretoria comprimento caneta fechada cor dourada peso diametro caneta clip comprimento caneta aberta diametro caneta clip,Papelaria
caneta exportar prata estojo veludo,Papelaria
caneta exportacao prata estojo veludo caneta complemento esportacao gravar logo grupo base estojo veludo cor prata unidade medida ncm,Papelaria
caneta exportacao prata estojo veludo cor cor unica caneta complemento esportacao gravar logo grupo base estojo veludo cor prata unidade medida ncm,Papelaria
caneta fixa corrente suporte fixacao caneta tipo fixa suporte corrente material metal,Papelaria
caneta fixa corrente suporte fixacao cor cor unica caneta tipo fixa suporte corrente material metal,Papelaria
caneta giz apagado guia caneta giz marca agia aplicacao macaco paineis,Papelaria
caneta giz apagado guia cor cor unica caneta giz marca agia aplicacao macaco paineis,Papelaria
caneta giz apagado guia,Papelaria
caneta hidrocor futura cor cor unica,Papelaria
caneta hidrocor futura cor cor unica,Papelaria
caneta hidrocor futura cor cor unica,Papelaria
caneta hidrografica cor caneta tipo hidrografica cor,Papelaria
caneta hidrografica cor cor cor unica caneta tipo hidrografica cor,Papelaria
caneta ipod cor cor unica,Papelaria
caneta kilometrica,Papelaria
caneta lumicolor amarela,Papelaria
caneta lumicolor amarela,Papelaria
caneta lumicolor amarela cor cor unica,Papelaria
caneta lumicolor amarela cor cor unica,Papelaria
caneta lumicolor amarela cor cor unica caneta lumicolor amarela,Papelaria
caneta lumicolor caneta tipo lumicolor cor,Papelaria
caneta lumicolor caneta tipo lumicolor cor,Papelaria
caneta lumicolor cor cor unica,Papelaria
caneta lumicolor cor cor unica caneta tipo lumicolor cor,Papelaria
caneta lumicolor cor cor unica,Papelaria
caneta lumicolor caneta tipo lumicolor cor,Papelaria
caneta lumicolor cor cor unica,Papelaria
caneta lumicolor cor cor unica caneta tipo lumicolor cor,Papelaria
caneta lumicolor cor cor unica,Papelaria
caneta magica tecido,Papelaria
caneta magica tecido,Papelaria
caneta magica tecido caneta magica marca premir,Papelaria
caneta magica tecido cor cor unica caneta magica marca premir,Papelaria
caneta magica tecido,Papelaria
caneta magica tecido,Papelaria
caneta magica tecido caneta magica marca premir,Papelaria
caneta magica tecido cor caneta magica marca premir,Papelaria
caneta magica tecido caneta magica marca premir,Papelaria
caneta magica tecido cor cor unica caneta magica marca premir,Papelaria
caneta magia keep clean star caneta magica buraco tipo air erasable pen caneta apagarem fabricante keep clean star,Papelaria
caneta magia keep clean star roxa,Papelaria
caneta magia keep clean star roxa cor cor unica caneta magica buraco tipo air erasable pen caneta apagarem fabricante keep clean star,Papelaria
caneta marcador tecido cor cor unica,Papelaria
caneta marcador tecido air apagarem,Papelaria
caneta marcador tecido air apagarem cor cor unica,Papelaria
caneta marcador tecido cor cor unica,Papelaria
caneta marcador tecido cor cor unica,Papelaria
caneta marcador saint,Papelaria
caneta marcador saint,Papelaria
caneta marcador saint cor cor unica,Papelaria
caneta marca texto,Papelaria
caneta marca texto medo caneta marca texto blush medo pacote unidades material plastico,Papelaria
caneta marca texto medo cor cor unica caneta marca texto blush medo pacote unidades material plastico,Papelaria
caneta marca texto nada cor cor unica caneta marca texto cor dimensoes aproximada,Papelaria
caneta mil,Papelaria
caneta mil cor cor unica caneta colocar mil,Papelaria
caneta mil metal roller caneta marca mega brindes modelo caneta roller aluminio escrita complemento personalizada logo mil ncm,Papelaria
caneta mil metal roller cor cor unica caneta marca mega brindes modelo caneta roller aluminio escrita complemento personalizada logo mil ncm,Papelaria
caneta multidao permanente fazer castelo cor cor unica caneta multidao permanente fazer castelo ponta dia,Papelaria
caneta multidao permanente fazer castelo cor cor unica caneta multidao permanente fazer castelo ponta dia,Papelaria
caneta multidao permanente fazer castelo ponta dia,Papelaria
caneta ranking,Papelaria
caneta ranking cor cor unica,Papelaria
caneta ranking uniria,Papelaria
caneta ranking uniria cor cor unica,Papelaria
caneta ranking uniria cor cor unica,Papelaria
caneta ranking uni pin fine line,Papelaria
caneta ranking uni pin fine line cor cor unica,Papelaria
caneta ranking uni pin fine line,Papelaria
caneta ranking uni pin fine line cor cor unica,Papelaria
caneta ranking uni pin fine line,Papelaria
caneta ranking uni pin fine line cor cor unica,Papelaria
caneta papel mate cor cor unica,Papelaria
caneta retro projetor,Papelaria
caneta retro projetor cor cor unica,Papelaria
caneta retro projetor,Papelaria
caneta retro projetor cor cor unica,Papelaria
caneta retro projetor cor cor unica,Papelaria
caneta retro projetor ver,Papelaria
caneta retro projetor cor cor unica,Papelaria
caneta tecido cor cor unica,Papelaria
caneta caligrafia pontas tombo cor,Papelaria
caneta caligrafia pontas tombo cor,Papelaria
caneta peru possa uni ponta caneta permanente possa uni cor ponta,Papelaria
caneta peru possa uni ponta cor cor unica caneta permanente possa uni cor ponta,Papelaria
caneta peru possa uni ponta prata caneta permanente possa uni cor prata ponta,Papelaria
caneta peru possa uni ponta prata cor cor unica caneta permanente possa uni cor prata ponta,Papelaria
caneta cima pen blush segura,Papelaria
caneta cima pen blush segura cor cor unica,Papelaria
caneta cima sensei segura xwk caneta cima sensei chanfrado segura xwk,Papelaria
caneta cima sensei segura xwk cor cor unica caneta cima sensei chanfrado segura xwk,Papelaria
caneta pincel atomico,Papelaria
caneta pincel atomico caneta pincel atomico cor espessura ponta,Papelaria
caneta pincel atomico cor cor unica caneta pincel atomico cor espessura ponta,Papelaria
caneta pincel atomico,Papelaria
caneta pincel atomico caneta pincel atomico cor espessura ponta,Papelaria
caneta pincel atomico cor cor unica caneta pincel atomico cor espessura ponta,Papelaria
caneta pincel atomico ref,Papelaria
caneta pincel atomico ref,Papelaria
caneta pincel atomico ref,Papelaria
caneta pincel atomico ref cor cor unica,Papelaria
caneta pincel atomico ref cor cor unica,Papelaria
caneta pincel atomico ref,Papelaria
caneta pincel atomico ref,Papelaria
caneta pincel atomico ref cor cor unica,Papelaria
caneta pincel atomico ref cor cor unica,Papelaria
caneta pincel atomico ref,Papelaria
caneta pincel atomico ref,Papelaria
caneta pincel atomico ref,Papelaria
caneta pincel atomico ref cor cor unica,Papelaria
caneta pincel atomico ref cor cor unica,Papelaria
caneta pincel atomico,Papelaria
caneta pincel atomico caneta pincel atomico cor espessura ponta,Papelaria
caneta pincel atomico cor cor unica caneta pincel atomico cor espessura ponta,Papelaria
caneta marca malha partes,Papelaria
caneta mesa digitalizado caneta aplicacao mesa digitalizado marca referencia nivel pressao ponta ponta substituivel compatibilidade cth cth ctl,Papelaria
caneta mesa digitalizado cor cor unica caneta aplicacao mesa digitalizado marca referencia nivel pressao ponta ponta substituivel compatibilidade cth cth ctl,Papelaria
caneta pow mak hidra pon prata caneta power make compacto hidrocor cor prata ponta,Papelaria
caneta pow mak hidra pon prata cor cor unica caneta power make compacto hidrocor cor prata ponta,Papelaria
caneta quadro branco ponta fina cor cor unica,Papelaria
caneta retro projetor,Papelaria
caneta retro projetor,Papelaria
caneta retro projetor cor cor unica caneta retro projetor,Papelaria
caneta retro projetor,Papelaria
caneta retro projetor,Papelaria
caneta retro projetor caneta retro projetor cor,Papelaria
caneta retro projetor cor cor unica caneta retro projetor cor,Papelaria
